{
  "$schema": "http://json-schema.org/draft-07/schema#",
  "title": "structure",
  "type": "object",
  "required": ["meta", "intent", "structure", "layout"],
  "properties": {
    "meta": {
      "type": "object",
      "required": ["schema_version", "lifecycle", "source_hash"],
      "properties": {
        "schema_version": { "type": "string" },
        "lifecycle": {
          "type": "string",
          "enum": ["INTENT", "CONSTRAINTS_DEFINED", "ENGINEERED", "GEOMETRY_SEALED", "CAD_SEALED", "RENDERED"]
        },
        "source_hash": { "type": "string" },
        "topology_family": {
          "type": "string",
          "enum": ["RadialHubTopology", "OrthogonalGridTopology", "HipRidgeTopology"],
          "description": "C1: reserved families validate then return TOPOLOGY_NOT_IMPLEMENTED; only RadialHubTopology is enabled."
        },
        "revision_id": { "type": "string", "minLength": 1, "description": "C5: committed revision UUID assigned by the transaction authority." },
        "revision_hash": { "type": "string", "pattern": "^[0-9a-f]{64}$", "description": "C5: gsd-json-v1 SHA-256 of the canonical document." },
        "updated_at": { "type": "string" }
      }
    },
    "intent": {
      "type": "object",
      "required": ["jurisdiction"],
      "properties": {
        "jurisdiction": { "type": "string" },
        "material_preference": { "type": "string" },
        "joinery_style": { "type": "string" }
      }
    },
    "materials": {
      "type": "object",
      "properties": {
        "primary": { "type": "string" }
      },
      "additionalProperties": true
    },
    "structure": {
      "type": "object",
      "required": ["type", "shape", "sides"],
      "properties": {
        "type": { "type": "string" },
        "shape": { "type": "string" },
        "sides": { "type": "integer", "minimum": 3 }
      }
    },
    "layout": {
      "type": "object",
      "required": ["post_count", "inscribed_radius_ft"],
      "properties": {
        "post_count": { "type": "integer", "minimum": 3 },
        "inscribed_radius_ft": { "type": "number", "exclusiveMinimum": 0 },
        "post_spacing_ft": { "type": "number" }
      }
    },
    "members": {
      "type": "object",
      "required": ["posts", "beams"],
      "properties": {
        "posts": {
          "type": "object",
          "required": ["nominal_size", "actual_width_in", "actual_depth_in", "cut_length_ft"],
          "properties": {
            "nominal_size": { "type": "string" },
            "actual_width_in": { "type": "number", "exclusiveMinimum": 0 },
            "actual_depth_in": { "type": "number", "exclusiveMinimum": 0 },
            "cut_length_ft": { "type": "number", "exclusiveMinimum": 0 }
          }
        },
        "beams": {
          "type": "object",
          "required": ["nominal_size", "actual_width_in", "actual_depth_in", "cut_length_ft"],
          "properties": {
            "nominal_size": { "type": "string" },
            "actual_width_in": { "type": "number", "exclusiveMinimum": 0 },
            "actual_depth_in": { "type": "number", "exclusiveMinimum": 0 },
            "cut_length_ft": { "type": "number", "exclusiveMinimum": 0 }
          }
        }
      }
    },
    "roof": {
      "type": "object",
      "required": ["type", "pitch", "primary_rafters"],
      "properties": {
        "type": { "type": "string" },
        "pitch": { "type": "string", "pattern": "^\\d+:\\d+$" },
        "pitch_defaulted": { "type": "boolean" },
        "primary_rafters": {
          "type": "object",
          "required": ["count", "nominal_size", "actual_width_in", "actual_depth_in", "overhang_ft"],
          "properties": {
            "count": { "type": "integer", "minimum": 3 },
            "nominal_size": { "type": "string" },
            "actual_width_in": { "type": "number", "exclusiveMinimum": 0 },
            "actual_depth_in": { "type": "number", "exclusiveMinimum": 0 },
            "overhang_ft": { "type": "number", "minimum": 0 }
          }
        },
        "secondary_members": {
          "type": "object",
          "properties": {
            "jack_rafters": {
              "type": "object",
              "properties": {
                "enabled": { "type": "boolean" },
                "count_per_side": { "type": "integer", "minimum": 0 }
              }
            },
            "purlin_ring": {
              "type": "object",
              "properties": {
                "enabled": { "type": "boolean" },
                "radius_ratio": { "type": "number", "minimum": 0.0, "maximum": 1.0 }
              }
            }
          }
        }
      }
    },
    "hub": {
      "type": "object",
      "required": ["type", "radius_min_ft"],
      "properties": {
        "type": { "type": "string" },
        "radius_ft": {
          "oneOf": [
            { "type": "number", "exclusiveMinimum": 0 },
            { "type": "string", "const": "auto" }
          ]
        },
        "radius_min_ft": { "type": "number", "exclusiveMinimum": 0 },
        "height_ratio_to_rafter": { "type": "number", "exclusiveMinimum": 0 },
        "clearance_ft": { "type": "number", "minimum": 0 }
      }
    },
    "bracing": {
      "type": "object",
      "required": ["enabled"],
      "properties": {
        "enabled": { "type": "boolean" },
        "layout": { "type": "string" },
        "brace": {
          "type": "object",
          "required": ["actual_width_in", "actual_depth_in", "count_per_post", "constraints"],
          "properties": {
            "nominal_size": { "type": "string" },
            "actual_width_in": { "type": "number", "exclusiveMinimum": 0 },
            "actual_depth_in": { "type": "number", "exclusiveMinimum": 0 },
            "count_per_post": { "type": "integer", "minimum": 1 },
            "constraints": {
              "type": "object",
              "required": ["start_surface", "end_surface"],
              "properties": {
                "start_surface": { "type": "string" },
                "end_surface": { "type": "string" },
                "run_ft": {
                  "type": "number",
                  "description": "Optional horizontal run. Default: min(1.5, beam_chord * 0.3)"
                }
              }
            }
          }
        }
      }
    },
    "footings": {
      "type": "object",
      "required": ["type", "diameter_in", "depth_in"],
      "properties": {
        "type": { "type": "string" },
        "diameter_in": { "type": "number", "exclusiveMinimum": 0 },
        "depth_in": { "type": "number", "exclusiveMinimum": 0 },
        "concrete_grade": { "type": "string" }
      }
    },
    "joinery": {
      "type": "object",
      "properties": {
        "beam_seat_style": { "type": "string" },
        "rafter_tail": { "type": "string" },
        "rafter_seat_style": { "type": "string" }
      }
    },
    "invariants": {
      "type": "object",
      "properties": {
        "rafter_count_equals_post_count": { "type": "boolean" },
        "post_top_equals_beam_bottom": { "type": "boolean" },
        "no_rafter_inside_hub_radius": { "type": "boolean" },
        "brace_must_connect_to_surfaces": { "type": "boolean" },
        "no_solid_intersections": { "type": "boolean" },
        "member_counts_match_sections": { "type": "boolean" },
        "no_zero_length_members": { "type": "boolean" },
        "presentation_primary_counts_match": { "type": "boolean" }
      }
    },
    "presentation": {
      "type": "object",
      "properties": {
        "view_mode": { "type": "string" },
        "roof_style": { "type": "string" },
        "visibility_rules": { "type": "object" },
        "labeling": { "type": "object" },
        "palette": { "type": "string" }
      }
    },
    "code": { "type": "object", "additionalProperties": true },
    "geometry": { "type": "object", "additionalProperties": true },
    "cad": { "type": "object", "additionalProperties": true },
    "cad_constraints": {
      "type": "object",
      "properties": {
        "reference_planes": {
          "type": "array",
          "items": {
            "type": "object",
            "required": ["id", "type", "point", "normal"],
            "properties": {
              "id": { "type": "string" },
              "type": { "enum": ["beam_top", "beam_soffit", "post_face", "roof_plane", "hub_face", "footing_top"] },
              "point": { "type": "array", "items": { "type": "number" }, "minItems": 3, "maxItems": 3 },
              "normal": { "type": "array", "items": { "type": "number" }, "minItems": 3, "maxItems": 3 }
            }
          }
        },
        "member_constraints": {
          "type": "array",
          "items": {
            "type": "object",
            "required": ["member_id", "constraints"],
            "properties": {
              "member_id": { "type": "string" },
              "constraints": { "type": "object" }
            }
          }
        },
        "global_constraints": {
          "type": "object",
          "required": ["roof_planes", "proportion_rules"],
          "properties": {
            "roof_planes": {
              "type": "array",
              "items": {
                "type": "object",
                "required": ["id", "defined_by", "pitch"],
                "properties": {
                  "id": { "type": "string" },
                  "defined_by": { "type": "array", "items": { "type": "string" } },
                  "pitch": { "type": "string" }
                }
              }
            },
            "proportion_rules": {
              "type": "object",
              "required": ["beam_depth_gt_rafter_depth", "hub_height_lte_beam_depth_x1.2", "brace_length_lte_post_height_x0.4"],
              "properties": {
                "beam_depth_gt_rafter_depth": { "type": "boolean" },
                "hub_height_lte_beam_depth_x1.2": { "type": "boolean" },
                "brace_length_lte_post_height_x0.4": { "type": "boolean" }
              }
            },
            "symmetry": { "type": "string" }
          }
        }
      },
      "additionalProperties": false
    }
  },
  "additionalProperties": false
}
