{
  "meta": {
    "schema_version": "2.0",
    "lifecycle": "GEOMETRY_SEALED",
    "source_hash": "intent_10ft_hex_pergola_yellow_cedar_20261011",
    "created_at": "2026-10-11T00:00:00-07:00",
    "updated_at": "2026-10-12T02:11:07.970154+00:00",
    "topology_family": "RadialHubTopology",
    "revision_id": "rev-10ft-hex-pergola-20261011-001",
    "revision_hash": "5d5b3de9609bfa3d06dde79c007a97dd0db1ed3c1dd72817de9196481fb9c773"
  },
  "intent": {
    "jurisdiction": "BC_SAANICH",
    "material_preference": "Yellow Cedar",
    "joinery_style": "traditional_timber_frame"
  },
  "materials": {
    "primary": "Yellow Cedar",
    "secondary": "Yellow Cedar"
  },
  "structure": {
    "type": "pergola",
    "shape": "hexagon",
    "sides": 6
  },
  "layout": {
    "shape": "regular_polygon",
    "post_count": 6,
    "inscribed_radius_ft": 5.0,
    "post_spacing_ft": 5.0
  },
  "members": {
    "posts": {
      "nominal_size": "8x8",
      "actual_width_in": 7.5,
      "actual_depth_in": 7.5,
      "cut_length_ft": 9.0
    },
    "beams": {
      "nominal_size": "6x12",
      "actual_width_in": 6.0,
      "actual_depth_in": 12.0,
      "cut_length_ft": 5.0
    }
  },
  "roof": {
    "type": "flat",
    "pitch": "0:12",
    "pitch_defaulted": false,
    "primary_rafters": {
      "count": 6,
      "nominal_size": "4x6",
      "actual_width_in": 3.5,
      "actual_depth_in": 5.5,
      "overhang_ft": 0.75
    },
    "secondary_rafters": {
      "enabled": false,
      "count_per_side": 0,
      "actual_width_in": 3.5,
      "actual_depth_in": 5.5
    }
  },
  "hub": {
    "type": "hexagonal_prism",
    "radius_ft": "auto",
    "radius_min_ft": 0.6,
    "height_ratio_to_rafter": 2.5,
    "clearance_ft": 0.5,
    "face_alignment": "mid_angle"
  },
  "bracing": {
    "enabled": true,
    "layout": "paired_per_post",
    "brace": {
      "nominal_size": "4x4",
      "actual_width_in": 3.5,
      "actual_depth_in": 3.5,
      "count_per_post": 2,
      "constraints": {
        "start_surface": "post_face",
        "end_surface": "beam_soffit",
        "run_ft": 1.5
      }
    }
  },
  "footings": {
    "type": "sonotube",
    "diameter_in": 12,
    "depth_in": 24,
    "concrete_grade": "20MPa"
  },
  "joinery": {
    "beam_seat_style": "exposed_tenon",
    "rafter_tail": "decorative_scallop",
    "rafter_seat_style": "birds_mouth"
  },
  "invariants": {
    "rafter_count_equals_post_count": true,
    "post_top_equals_beam_bottom": true,
    "no_rafter_inside_hub_radius": true,
    "brace_must_connect_to_surfaces": true,
    "no_solid_intersections": true,
    "member_counts_match_sections": true,
    "no_zero_length_members": true,
    "presentation_primary_counts_match": true
  },
  "presentation": {
    "view_mode": "presentation",
    "roof_style": "open_pergola",
    "visibility_rules": {},
    "labeling": {
      "show_member_ids": true
    },
    "palette": "cedar_warm"
  },
  "code": {
    "_sealed": false,
    "edition": "BCBC_2024",
    "municipality": "Saanich",
    "region": "BC_SAANICH",
    "design_scope": "screening_only"
  },
  "geometry": {
    "_sealed": true,
    "compound_cut": {
      "miter_deg": 28.71,
      "bevel_deg": 9.1
    },
    "beam_ring": {
      "beam_miter_deg": 30.0,
      "interior_angle_deg": 120.0
    },
    "rafter": {
      "structural_length_ft": 5.0,
      "total_with_overhang_ft": 5.75
    },
    "roof_rise": {
      "rise_ft": 0.0
    },
    "total_height": {
      "post_ft": 9.0,
      "beam_depth_ft": 1.0,
      "roof_rise_ft": 0.0,
      "total_height_ft": 10.0
    },
    "hub_radius_ft": 0.75,
    "svg_coordinates": {
      "viewBox": "0 0 1600 1200",
      "width_px": 1600,
      "height_px": 1200,
      "grade_y": 1080,
      "scale_px_per_ft": 42.0,
      "post_top_y": 702,
      "beam_top_y": 660,
      "hub_apex_y": 660
    },
    "joints": {
      "units": "feet",
      "coordinate_system": "right_handed_z_up",
      "tolerance_ft": 0.0052,
      "z_planes": {
        "Z_GRADE": 0.0,
        "Z_POST_TOP": 8.0,
        "Z_BEAM_TOP": 9.0,
        "Z_BEAM_CENTER": 8.5,
        "Z_APEX": 9.0,
        "Z_BEAM_SOFFIT": 8.0
      },
      "layout": {
        "post_count": 6,
        "post_radius_ft": 5.0,
        "post_xy": [
          [
            5.0,
            0.0
          ],
          [
            2.5,
            4.3301
          ],
          [
            -2.5,
            4.3301
          ],
          [
            -5.0,
            0.0
          ],
          [
            -2.5,
            -4.3301
          ],
          [
            2.5,
            -4.3301
          ]
        ],
        "beam_segments": [
          {
            "id": "B1",
            "i0": 0,
            "i1": 1
          },
          {
            "id": "B2",
            "i0": 1,
            "i1": 2
          },
          {
            "id": "B3",
            "i0": 2,
            "i1": 3
          },
          {
            "id": "B4",
            "i0": 3,
            "i1": 4
          },
          {
            "id": "B5",
            "i0": 4,
            "i1": 5
          },
          {
            "id": "B6",
            "i0": 5,
            "i1": 0
          }
        ]
      },
      "hub": {
        "type": "hexagonal_prism",
        "radius_ft": 0.75,
        "height_ft": 1.2,
        "face_planes": {
          "planes": [
            {
              "id": "H1",
              "point": [
                0.75,
                0.0,
                9.0
              ],
              "normal": [
                1.0,
                0.0,
                0.0
              ]
            },
            {
              "id": "H2",
              "point": [
                0.3750000000000001,
                0.649519052838329,
                9.0
              ],
              "normal": [
                0.5000000000000001,
                0.8660254037844386,
                0.0
              ]
            },
            {
              "id": "H3",
              "point": [
                -0.3749999999999999,
                0.649519052838329,
                9.0
              ],
              "normal": [
                -0.49999999999999983,
                0.8660254037844387,
                0.0
              ]
            },
            {
              "id": "H4",
              "point": [
                -0.75,
                9.184850993605148e-17,
                9.0
              ],
              "normal": [
                -1.0,
                1.2246467991473532e-16,
                0.0
              ]
            },
            {
              "id": "H5",
              "point": [
                -0.37500000000000033,
                -0.6495190528383288,
                9.0
              ],
              "normal": [
                -0.5000000000000004,
                -0.8660254037844384,
                0.0
              ]
            },
            {
              "id": "H6",
              "point": [
                0.3750000000000001,
                -0.649519052838329,
                9.0
              ],
              "normal": [
                0.5000000000000001,
                -0.8660254037844386,
                0.0
              ]
            }
          ]
        }
      },
      "primary_rafters": [
        {
          "id": "R1",
          "start": [
            5.75,
            0.0,
            9.3056
          ],
          "end": [
            0.6495,
            0.0,
            9.3056
          ],
          "seat_point": [
            5.0,
            0.0,
            9.3056
          ],
          "seat_depth_ft": 0.3056
        },
        {
          "id": "R2",
          "start": [
            2.875,
            4.9796,
            9.3056
          ],
          "end": [
            0.3248,
            0.5625,
            9.3056
          ],
          "seat_point": [
            2.5,
            4.3301,
            9.3056
          ],
          "seat_depth_ft": 0.3056
        },
        {
          "id": "R3",
          "start": [
            -2.875,
            4.9796,
            9.3056
          ],
          "end": [
            -0.3248,
            0.5625,
            9.3056
          ],
          "seat_point": [
            -2.5,
            4.3301,
            9.3056
          ],
          "seat_depth_ft": 0.3056
        },
        {
          "id": "R4",
          "start": [
            -5.75,
            0.0,
            9.3056
          ],
          "end": [
            -0.6495,
            0.0,
            9.3056
          ],
          "seat_point": [
            -5.0,
            0.0,
            9.3056
          ],
          "seat_depth_ft": 0.3056
        },
        {
          "id": "R5",
          "start": [
            -2.875,
            -4.9796,
            9.3056
          ],
          "end": [
            -0.3248,
            -0.5625,
            9.3056
          ],
          "seat_point": [
            -2.5,
            -4.3301,
            9.3056
          ],
          "seat_depth_ft": 0.3056
        },
        {
          "id": "R6",
          "start": [
            2.875,
            -4.9796,
            9.3056
          ],
          "end": [
            0.3248,
            -0.5625,
            9.3056
          ],
          "seat_point": [
            2.5,
            -4.3301,
            9.3056
          ],
          "seat_depth_ft": 0.3056
        }
      ],
      "rafters": {
        "hub_termination_points": {
          "points": [
            [
              0.6495,
              0.0,
              9.3056
            ],
            [
              0.3248,
              0.5625,
              9.3056
            ],
            [
              -0.3248,
              0.5625,
              9.3056
            ],
            [
              -0.6495,
              0.0,
              9.3056
            ],
            [
              -0.3248,
              -0.5625,
              9.3056
            ],
            [
              0.3248,